{
  "$schema": "http://json-schema.org/draft-07/schema#",
  "type": "object",
  "title": "Environment Inventory Content",
  "description": "Schema for ENV_INVENTORY_CONTENT parameter that allows to create, replace, and delete Environment Inventory and related objects",
  "additionalProperties": false,
  "properties": {
    "envDefinition": {
      "type": "object",
      "title": "Environment Definition Block",
      "description": "Block that controls env_definition.yml",
      "additionalProperties": false,
      "properties": {
        "action": {
          "type": "string",
          "enum": ["create_or_replace", "delete"],
          "title": "Action",
          "description": "Operation mode for env_definition.yml"
        },
        "content": {
          "$ref": "env-definition.schema.json",
          "title": "Environment Definition Content",
          "description": "Full content of env_definition.yml"
        }
      },
      "required": ["action"],
      "if": {
        "properties": {
          "action": {
            "const": "create_or_replace"
          }
        }
      },
      "then": {
        "required": ["content"]
      }
    },
    "paramSets": {
      "type": "array",
      "title": "Parameter Sets",
      "description": "Block that controls Parameter Set file operations",
      "items": {
        "type": "object",
        "additionalProperties": false,
        "properties": {
          "action": {
            "type": "string",
            "enum": ["create_or_replace", "delete"],
            "title": "Action",
            "description": "Operation mode for the target Parameter Set file"
          },
          "place": {
            "type": "string",
            "enum": ["site", "cluster", "env"],
            "title": "Place",
            "description": "Defines where the Parameter Set file is stored"
          },
          "content": {
            "$ref": "paramset.schema.json",
            "title": "Parameter Set Content",
            "description": "Parameter Set definition as file content"
          },
          "name": {
            "type": "string",
            "title": "Name",
            "description": "Name of the Parameter Set file (without extension). Required for delete action. The file will be saved as <name>.yml"
          }
        },
        "required": ["action", "place"],
        "if": {
          "properties": {
            "action": {
              "const": "create_or_replace"
            }
          }
        },
        "then": {
          "required": ["content"]
        },
        "else": {
          "anyOf": [
            { "required": ["name"] },
            {
              "required": ["content"],
              "properties": {
                "content": { "required": ["name"] }
              }
            }
          ]
        }
      }
    },
    "credentials": {
      "type": "array",
      "title": "Shared Credentials",
      "description": "Block that controls Shared Credentials operations",
      "items": {
        "type": "object",
        "additionalProperties": false,
        "properties": {
          "action": {
            "type": "string",
            "enum": ["create_or_replace", "delete"],
            "title": "Action",
            "description": "Operation mode for the Shared Credentials file"
          },
          "place": {
            "type": "string",
            "enum": ["site", "cluster", "env"],
            "title": "Place",
            "description": "Defines where the Shared Credentials file is stored"
          },
          "content": {
            "$ref": "credential.schema.json",
            "title": "Shared Credentials Content",
            "description": "Shared Credential as file content"
          },
          "name": {
            "type": "string",
            "title": "Name",
            "description": "Name of the Shared Credentials File (without extension). The file will be saved as <name>.yml"
          }
        },
        "required": ["action", "place"],
        "if": {
          "properties": {
            "action": {
              "const": "create_or_replace"
            }
          }
        },
        "then": {
          "required": ["content"]
        },
        "else": {
          "required": ["name"]
        }
      }
    },
    "resourceProfiles": {
      "type": "array",
      "title": "Resource Profile Overrides",
      "description": "List of Resource Profile Override operations",
      "items": {
        "type": "object",
        "additionalProperties": false,
        "properties": {
          "action": {
            "type": "string",
            "enum": ["create_or_replace", "delete"],
            "title": "Action",
            "description": "Operation mode for the Resource Profile Override file"
          },
          "place": {
            "type": "string",
            "enum": ["site", "cluster", "env"],
            "title": "Place",
            "description": "Defines where the Resource Profile Override file is stored"
          },
          "content": {
            "$ref": "resource-profile.schema.json",
            "title": "Resource Profile Override Content",
            "description": "Resource Profile Override as file content"
          },
          "name": {
            "type": "string",
            "title": "Name",
            "description": "Name of the Resource Profile Override file (without extension). Required for delete action."
          }
        },
        "required": ["action", "place"],
        "if": {
          "properties": {
            "action": {
              "const": "create_or_replace"
            }
          }
        },
        "then": {
          "required": ["content"]
        },
        "else": {
          "anyOf": [
            { "required": ["name"] },
            {
              "required": ["content"],
              "properties": {
                "content": { "required": ["name"] }
              }
            }
          ]
        }
      }
    },
    "sharedTemplateVariables": {
      "type": "array",
      "title": "Shared Template Variable Files",
      "description": "Block that controls Shared Template Variable File operations",
      "items": {
        "type": "object",
        "additionalProperties": false,
        "properties": {
          "action": {
            "type": "string",
            "enum": ["create_or_replace", "delete"],
            "title": "Action",
            "description": "Operation mode for the Shared Template Variable File"
          },
          "place": {
            "type": "string",
            "enum": ["site", "cluster", "env"],
            "title": "Place",
            "description": "Defines where the Shared Template Variable File is stored"
          },
          "name": {
            "type": "string",
            "title": "File Name",
            "description": "Name of the Shared Template Variable File (without extension). The file will be saved as <name>.yml",
            "pattern": "^[^/\\\\\\.\\.]+$",
            "examples": ["prod-template-variables"]
          },
          "content": {
            "type": "object",
            "title": "Shared Template Variable File Content",
            "description": "Shared Template Variable File content as key-value hashmap. Must NOT be located in a parameters directory",
            "additionalProperties": true
          }
        },
        "required": ["action", "place", "name"],
        "if": {
          "properties": {
            "action": {
              "const": "create_or_replace"
            }
          }
        },
        "then": {
          "required": ["content"]
        }
      }
    },
    "specificTemplateVersions": {
      "type": "array",
      "title": "Specific Template Version Files",
      "description": "Block that controls Specific Template Version file operations",
      "items": {
        "type": "object",
        "additionalProperties": false,
        "properties": {
          "action": {
            "type": "string",
            "enum": ["create_or_replace", "delete"],
            "title": "Action",
            "description": "Operation mode for the Specific Template Version file"
          },
          "place": {
            "type": "string",
            "enum": ["site", "cluster", "env"],
            "title": "Place",
            "description": "Defines where the Specific Template Version file is stored"
          },
          "name": {
            "type": "string",
            "title": "Name",
            "description": "Name of the Specific Template Version file (without extension). Required for delete action."
          },
          "content": {
            "type": "object",
            "title": "Specific Template Version Content",
            "description": "Content of the Specific Template Version file",
            "additionalProperties": true
          }
        },
        "required": ["action", "place"],
        "if": {
          "properties": {
            "action": {
              "const": "create_or_replace"
            }
          }
        },
        "then": {
          "required": ["content"]
        }
      }
    },
    "templateVariables": {
      "type": "array",
      "title": "Template Variable Files",
      "description": "Block that controls Template Variable file operations",
      "items": {
        "type": "object",
        "additionalProperties": false,
        "properties": {
          "action": {
            "type": "string",
            "enum": ["create_or_replace", "delete"],
            "title": "Action",
            "description": "Operation mode for the Template Variable file"
          },
          "place": {
            "type": "string",
            "enum": ["site", "cluster", "env"],
            "title": "Place",
            "description": "Defines where the Template Variable file is stored"
          },
          "name": {
            "type": "string",
            "title": "Name",
            "description": "Name of the Template Variable file (without extension). Required for delete action."
          },
          "content": {
            "type": "object",
            "title": "Template Variable Content",
            "description": "Content of the Template Variable file as key-value hashmap",
            "additionalProperties": true
          }
        },
        "required": ["action", "place"],
        "if": {
          "properties": {
            "action": {
              "const": "create_or_replace"
            }
          }
        },
        "then": {
          "required": ["content"]
        }
      }
    }
  }
}
